{
  "$id": "https://schemas.meshmakers.cloud/construction-kit-compiled.schema.json",
  "$schema": "https://json-schema.org/draft/2020-12/schema",
  "type": "object",
  "properties": {
    "$schema": {
      "type": "string",
      "format": "uri"
    },
    "modelId": {
      "type": "string",
      "pattern": "^[a-zA-Z0-9-.]+$"
    },
    "dependencies": {
      "type": "array",
      "items": {
        "type": "string",
        "pattern": "^[a-zA-Z0-9-.]+$"
      }
    },
    "dependencyRanges": {
      "description": "CK v2 range retention (AB#5664): declared range and floor of each direct dependency.",
      "type": "array",
      "items": {
        "type": "object",
        "properties": {
          "range": {
            "type": "string",
            "pattern": "^[a-zA-Z0-9-.,\\[\\]()]+$"
          },
          "floor": {
            "type": "string",
            "pattern": "^[0-9]+(\\.[0-9]+){0,2}$"
          },
          "usedSurface": {
            "description": "CK v2 (AB#4472): sorted, de-duplicated, major-qualified ids of the dependency's elements this model uses (element level: System@2/Entity-1; member level: System@2/Entity-1.Name).",
            "type": "array",
            "items": {
              "type": "string"
            }
          },
          "usedSurfaceHash": {
            "description": "CK v2 (AB#4472): sha256 over usedSurface (one id per line, UTF-8), written as 'sha256:<hex>'.",
            "type": "string",
            "pattern": "^sha256:[0-9a-f]{64}$"
          }
        },
        "additionalProperties": false,
        "required": [
          "range",
          "floor"
        ]
      }
    },
    "minEngineVersion": {
      "type": "string",
      "pattern": "^\\d+\\.\\d+\\.\\d+$",
      "description": "CK v2 (F1.1-S6): lowest construction kit engine version that can read this model (major.minor.patch). Written for ckLanguage 2 and range-retaining output; an engine below it refuses the import (message 126)."
    },
    "description": {
      "type": "string"
    },
    "ckLanguage": {
      "type": "integer",
      "minimum": 1,
      "description": "CK language version (CK v2, AB#5584). Omitted = 1. Version 2 enables 'interfaces', 'implements', attribute 'access', 'methods', 'visibility', 'derivable' and 'targetCkInterfaceId'. Deliberately unbounded here: an engine that reads a compiled model with a higher version than it supports rejects it with message 91 (CkLanguageNotSupported) instead of a schema error."
    },
    "attributes": {
      "type": "array",
      "items": {
        "type": "object",
        "$ref": "https://schemas.meshmakers.cloud/construction-kit-elements-attribute.schema.json#/definitions/CkAttribute"
      }
    },
    "types": {
      "type": "array",
      "items": {
        "type": "object",
        "$ref": "https://schemas.meshmakers.cloud/construction-kit-elements-type.schema.json#/definitions/CkCompiledType"
      }
    },
    "associationRoles": {
      "type": "array",
      "items": {
        "type": "object",
        "$ref": "https://schemas.meshmakers.cloud/construction-kit-elements-associationRole.schema.json#/definitions/CkAssociationRole"
      }
    },
    "records": {
      "type": "array",
      "items": {
        "type": "object",
        "$ref": "https://schemas.meshmakers.cloud/construction-kit-elements-record.schema.json#/definitions/CkRecord"
      }
    },
    "enums": {
      "type": "array",
      "items": {
        "type": "object",
        "$ref": "https://schemas.meshmakers.cloud/construction-kit-elements-enum.schema.json#/definitions/CkEnum"
      }
    },
    "interfaces": {
      "type": "array",
      "items": {
        "type": "object",
        "$ref": "https://schemas.meshmakers.cloud/construction-kit-elements-interface.schema.json#/definitions/CkInterface"
      }
    },
    "migrations": {
      "type": "object",
      "properties": {
        "meta": {
          "$ref": "https://schemas.meshmakers.cloud/ck-migration-meta.schema.json#/definitions/CkMigrationMeta"
        },
        "scripts": {
          "type": "array",
          "items": {
            "$ref": "https://schemas.meshmakers.cloud/ck-migration.schema.json#/definitions/CkMigrationScript"
          }
        }
      },
      "additionalProperties": false,
      "required": [
        "meta"
      ]
    },
    "compatibility": {
      "type": "object",
      "description": "AB#6295: decisions of the model author about the compatibility gates (ckLanguage 2). Valid for exactly this release.",
      "properties": {
        "acknowledge": {
          "type": "array",
          "description": "Explicit acknowledgements of changes that need one (a security-sensitive access tightening, a unique index on a stable base). An entry that matches no change of this release is stale and fails the build (OCTO-CK204); a change that needs an acknowledgement and has none fails with OCTO-CK203. An acknowledgement never lowers the required version bump.",
          "items": {
            "type": "object",
            "properties": {
              "change": {
                "type": "string",
                "pattern": "^[^*?\\s][^*?]*$",
                "description": "The change key exactly as the compile gate prints it (OCTO-CK203). Exact match, no wildcards."
              },
              "reason": {
                "type": "string",
                "pattern": "\\S",
                "description": "Why the change is accepted. Mandatory."
              }
            },
            "additionalProperties": false,
            "required": [
              "change",
              "reason"
            ]
          }
        }
      },
      "additionalProperties": false
    }
  },
  "additionalProperties": false,
  "required": [
    "modelId"
  ]
}
